{"id":"9b2c0f1e-0000-4000-8000-0000000000a1","hash":"ba7816bf8f01cfea414140de5dae2223b00361a396177a9cb410ff61f20015ad","filename":"Notes.TXT","bucket_path":"ba/78/ba7816bf8f01cfea414140de5dae2223b00361a396177a9cb410ff61f20015ad","size":1048576,"attempts":1,"created_at":"2026-10-14T10:00:00.123Z","schema_version":1}
